<?xml version='1.0' encoding='UTF-8'?>
<FlowBasedConstraintDocument DtdRelease="4" DtdVersion="0" xmlns="flowbased" xmlns:xsi="http://www.w3.org/2001/XMLSchema-instance" xsi:noNamespaceSchemaLocation="flowbasedconstraintdocument-18.xsd">
  <DocumentIdentification v="17XTSO-CS------W-20190108-F301v1"/>
  <DocumentVersion v="1"/>
  <DocumentType v="B06"/>
  <ProcessType v="A01"/>
  <SenderIdentification codingScheme="A01" v="17XTSO-CS------W"/>
  <SenderRole v="A36"/>
  <ReceiverIdentification codingScheme="A01" v="22XCORESO------S"/>
  <ReceiverRole v="A44"/>
  <CreationDateTime v="2019-08-15T14:07:28Z"/>
  <ConstraintTimeInterval v="2019-01-07T23:00Z/2019-01-08T23:00Z"/>
  <Domain codingScheme="A01" v="10Y1001C--00059P"/>
  <criticalBranches>
    <criticalBranch id="fr1_fr2_n_dir">
      <timeInterval v="2019-01-07T23:00Z/2019-01-08T23:00Z"/>
      <branch name="FR1-FR2" from="FFR1AA1" to="FFR2AA1" order="1" eic="1234567890123451"/>
      <imaxA>1443</imaxA>
      <imaxType>FIXED</imaxType>
      <frmMw>0</frmMw>
      <minRAMfactor>100</minRAMfactor>
      <CNEC>true</CNEC>
      <MNEC>false</MNEC>
      <direction>DIRECT</direction>
      <tsoOrigin>FR</tsoOrigin>
    </criticalBranch>
    <criticalBranch id="fr1_fr2_n_opp">
      <timeInterval v="2019-01-07T23:00Z/2019-01-08T23:00Z"/>
      <branch name="FR1-FR2" from="FFR1AA1" to="FFR2AA1" order="1" eic="1234567890123451"/>
      <imaxA>1443</imaxA>
      <imaxType>FIXED</imaxType>
      <frmMw>0</frmMw>
      <minRAMfactor>100</minRAMfactor>
      <CNEC>true</CNEC>
      <MNEC>false</MNEC>
      <direction>OPPOSITE</direction>
      <tsoOrigin>FR</tsoOrigin>
    </criticalBranch>
    <criticalBranch id="fr2_de3_n_dir">
      <timeInterval v="2019-01-07T23:00Z/2019-01-08T23:00Z"/>
      <branch name="FR2-DE3" from="FFR2AA1" to="DDE3AA1" order="1" eic="1234567890123451"/>
      <imaxA>7215</imaxA>
      <imaxType>FIXED</imaxType>
      <frmMw>0</frmMw>
      <minRAMfactor>100</minRAMfactor>
      <CNEC>true</CNEC>
      <MNEC>false</MNEC>
      <direction>DIRECT</direction>
      <tsoOrigin>FR</tsoOrigin>
    </criticalBranch>
    <criticalBranch id="fr2_de3_n_opp">
      <timeInterval v="2019-01-07T23:00Z/2019-01-08T23:00Z"/>
      <branch name="FR2-DE3" from="FFR2AA1" to="DDE3AA1" order="1" eic="1234567890123451"/>
      <imaxA>7215</imaxA>
      <imaxType>FIXED</imaxType>
      <frmMw>0</frmMw>
      <minRAMfactor>100</minRAMfactor>
      <CNEC>true</CNEC>
      <MNEC>false</MNEC>
      <direction>OPPOSITE</direction>
      <tsoOrigin>FR</tsoOrigin>
    </criticalBranch>
    <criticalBranch id="de2_nl3_n_dir">
      <timeInterval v="2019-01-07T23:00Z/2019-01-08T23:00Z"/>
      <branch name="DE2-NL3" from="DDE2AA1" to="NNL3AA1" order="1" eic="1234567890123451"/>
      <imaxA>7215</imaxA>
      <imaxType>FIXED</imaxType>
      <frmMw>0</frmMw>
      <minRAMfactor>100</minRAMfactor>
      <CNEC>true</CNEC>
      <MNEC>false</MNEC>
      <direction>DIRECT</direction>
      <tsoOrigin>FR</tsoOrigin>
    </criticalBranch>
    <criticalBranch id="de2_nl3_n_opp">
      <timeInterval v="2019-01-07T23:00Z/2019-01-08T23:00Z"/>
      <branch name="DE2-NL3" from="DDE2AA1" to="NNL3AA1" order="1" eic="1234567890123451"/>
      <imaxA>7215</imaxA>
      <imaxType>FIXED</imaxType>
      <frmMw>0</frmMw>
      <minRAMfactor>100</minRAMfactor>
      <CNEC>true</CNEC>
      <MNEC>false</MNEC>
      <direction>OPPOSITE</direction>
      <tsoOrigin>FR</tsoOrigin>
    </criticalBranch>
    <criticalBranch id="nl2_be3_n_dir">
      <timeInterval v="2019-01-07T23:00Z/2019-01-08T23:00Z"/>
      <branch name="NL2-BE3" from="NNL2AA1" to="BBE3AA1" order="1" eic="1234567890123451"/>
      <imaxA>7215</imaxA>
      <imaxType>FIXED</imaxType>
      <frmMw>0</frmMw>
      <minRAMfactor>100</minRAMfactor>
      <CNEC>true</CNEC>
      <MNEC>false</MNEC>
      <direction>DIRECT</direction>
      <tsoOrigin>FR</tsoOrigin>
    </criticalBranch>
    <criticalBranch id="nl2_be3_n_opp">
      <timeInterval v="2019-01-07T23:00Z/2019-01-08T23:00Z"/>
      <branch name="NL2-BE3" from="NNL2AA1" to="BBE3AA1" order="1" eic="1234567890123451"/>
      <imaxA>7215</imaxA>
      <imaxType>FIXED</imaxType>
      <frmMw>0</frmMw>
      <minRAMfactor>100</minRAMfactor>
      <CNEC>true</CNEC>
      <MNEC>false</MNEC>
      <direction>OPPOSITE</direction>
      <tsoOrigin>FR</tsoOrigin>
    </criticalBranch>
    <criticalBranch id="be2_fr3_n_dir">
      <timeInterval v="2019-01-07T23:00Z/2019-01-08T23:00Z"/>
      <branch name="BE2-FR3" from="BBE2AA1" to="FFR3AA1" order="1" eic="1234567890123451"/>
      <imaxA>7215</imaxA>
      <imaxType>FIXED</imaxType>
      <frmMw>0</frmMw>
      <minRAMfactor>100</minRAMfactor>
      <CNEC>true</CNEC>
      <MNEC>false</MNEC>
      <direction>DIRECT</direction>
      <tsoOrigin>FR</tsoOrigin>
    </criticalBranch>
    <criticalBranch id="be2_fr3_n_opp">
      <timeInterval v="2019-01-07T23:00Z/2019-01-08T23:00Z"/>
      <branch name="BE2-FR3" from="BBE2AA1" to="FFR3AA1" order="1" eic="1234567890123451"/>
      <imaxA>7215</imaxA>
      <imaxType>FIXED</imaxType>
      <frmMw>0</frmMw>
      <minRAMfactor>100</minRAMfactor>
      <CNEC>true</CNEC>
      <MNEC>false</MNEC>
      <direction>OPPOSITE</direction>
      <tsoOrigin>FR</tsoOrigin>
    </criticalBranch>
    <criticalBranch id="nl2_nl3_n_dir">
      <timeInterval v="2019-01-07T23:00Z/2019-01-08T23:00Z"/>
      <branch name="NL2-NL3" from="NNL2AA1" to="NNL3AA1" order="1" eic="1234567890123451"/>
      <imaxA>7215</imaxA>
      <imaxType>FIXED</imaxType>
      <frmMw>0</frmMw>
      <minRAMfactor>100</minRAMfactor>
      <CNEC>false</CNEC>
      <MNEC>true</MNEC>
      <direction>DIRECT</direction>
      <tsoOrigin>FR</tsoOrigin>
    </criticalBranch>
    <criticalBranch id="nl2_nl3_n_opp">
      <timeInterval v="2019-01-07T23:00Z/2019-01-08T23:00Z"/>
      <branch name="NL2-NL3" from="NNL2AA1" to="NNL3AA1" order="1" eic="1234567890123451"/>
      <imaxA>7215</imaxA>
      <imaxType>FIXED</imaxType>
      <frmMw>0</frmMw>
      <minRAMfactor>100</minRAMfactor>
      <CNEC>false</CNEC>
      <MNEC>true</MNEC>
      <direction>OPPOSITE</direction>
      <tsoOrigin>FR</tsoOrigin>
    </criticalBranch>
    <criticalBranch id="nl1_nl3_n_dir">
      <timeInterval v="2019-01-07T23:00Z/2019-01-08T23:00Z"/>
      <branch name="NL1-NL3" from="NNL1AA1" to="NNL3AA1" order="1" eic="1234567890123451"/>
      <imaxA>7215</imaxA>
      <imaxType>FIXED</imaxType>
      <frmMw>0</frmMw>
      <minRAMfactor>100</minRAMfactor>
      <CNEC>true</CNEC>
      <MNEC>false</MNEC>
      <direction>DIRECT</direction>
      <tsoOrigin>FR</tsoOrigin>
    </criticalBranch>
    <criticalBranch id="nl1_nl3_n_opp">
      <timeInterval v="2019-01-07T23:00Z/2019-01-08T23:00Z"/>
      <branch name="NL1-NL3" from="NNL1AA1" to="NNL3AA1" order="1" eic="1234567890123451"/>
      <imaxA>7215</imaxA>
      <imaxType>FIXED</imaxType>
      <frmMw>0</frmMw>
      <minRAMfactor>100</minRAMfactor>
      <CNEC>true</CNEC>
      <MNEC>false</MNEC>
      <direction>OPPOSITE</direction>
      <tsoOrigin>FR</tsoOrigin>
    </criticalBranch>
  </criticalBranches>
  <complexVariants>
    <complexVariant id="PRA_PST_BE" name="PRA_PST_BE">
      <timeInterval v="2019-01-07T23:00Z/2019-01-08T23:00Z"/>
      <tsoOrigin>BE</tsoOrigin>
      <actionsSet name="PRA_PST_BE">
        <preventive>true</preventive>
        <curative>false</curative>
        <enforced>false</enforced>
        <action type="PSTTAP">
          <branch order="1" from="BBE2AA1" to="BBE3AA1"/>
          <range>
            <min>-16</min>
            <max>16</max>
          </range>
        </action>
      </actionsSet>
    </complexVariant>
  </complexVariants>
</FlowBasedConstraintDocument>
